<?xml version="1.0" encoding="UTF-8"?>
<nomDeCouleur xmlns:xsi="http://www.w3.org/2001/XMLSchema-instance"
              xsi:noNamespaceSchemaLocation="couleur.xsd">


    <piece>
        <nom>roi</nom>
        <position>
            <colonne>G</colonne>
            <ligne>1</ligne>
        </position>
    </piece>

    <piece>
        <nom>fou</nom>
        <position>
            <colonne>D</colonne>
            <ligne>6</ligne>
        </position>
    </piece>

    <piece>
        <nom>pion</nom>
        <position>
            <colonne>H</colonne>
            <ligne>5</ligne>
        </position>
    </piece>

    <piece>
        <nom>reine</nom>
        <position>
            <colonne>H</colonne>
            <ligne>4</ligne>
        </position>
    </piece>

</nomDeCouleur>
